[{
  "iata":"abj",
  "icao": "diap",
  "coordinates":{
    "latitude": "5ยบ15'41.1\"N",
    "longitude": "003ยบ55'32.8\"W"
  },
  "runway": {
    "direction": "03/21",
    "length":{
      "ft": 9842,
      "m": 3000
    },
    "surface": "macadam"
  }
}, {
  "iata":"abj",
  "icao": "diap",
  "coordinates":{
    "latitude": "5ยบ15'41.1\"N",
    "longitude": "003ยบ55'32.8\"W"
  },
  "runway": {
    "direction": "03/21",
    "length":{
      "ft": 9842,
      "m": 3000
    },
    "surface": "macadam"
  }
}
]